{
  "$schema": "https://json-schema.org/draft/2020-12/schema",
  "$id": "https://cinna.dev/schema/cinna-agent.schema.json",
  "title": "cinna-agent.json",
  "description": "Definitional metadata for a locally built agent. Lives at the agent folder root and travels unchanged into a cloud agent workspace and into bundle revisions. Unknown keys are preserved for forward compatibility.",
  "type": "object",
  "required": [
    "name",
    "slug",
    "description"
  ],
  "allOf": [
    {
      "$comment": "Identity is required of every folder scaffolded at contract 1.0.0 or later, and tolerated as absent in exactly one case: a legacy folder, which carries the integer schema_version and neither contract_version nor id. Such a folder must still parse - it is read, reported, and re-stamped - which is why contract_version and id are not in the top-level `required`. Any other manifest needs both. This encodes the same rule as the desktop's checkIdentity() and the CHANGELOG's Compatibility table; if you change one, change all three.",
      "if": {
        "allOf": [
          {
            "required": [
              "schema_version"
            ]
          },
          {
            "not": {
              "required": [
                "contract_version"
              ]
            }
          },
          {
            "not": {
              "required": [
                "id"
              ]
            }
          }
        ]
      },
      "then": {
        "$comment": "Legacy folder: read it, warn, ask for a re-stamp."
      },
      "else": {
        "required": [
          "contract_version",
          "id"
        ]
      }
    }
  ],
  "additionalProperties": true,
  "properties": {
    "contract_version": {
      "description": "Version of the folder contract this agent was scaffolded against, and the compatibility gate: a tool whose contract major is older than this must refuse to operate the folder. Required of every folder except a legacy one (see the top-level allOf).",
      "type": "string",
      "pattern": "^(0|[1-9]\\d*)\\.(0|[1-9]\\d*)\\.(0|[1-9]\\d*)(?:-[0-9A-Za-z-.]+)?$"
    },
    "id": {
      "description": "Stable identity of this agent, written once at scaffold and never rewritten. Survives folder moves and slug renames; preserved through cloud import as the agent's local origin. Required of every folder except a legacy one (see the top-level allOf).",
      "type": "string",
      "pattern": "^[0-9a-fA-F]{8}-[0-9a-fA-F]{4}-[0-9a-fA-F]{4}-[0-9a-fA-F]{4}-[0-9a-fA-F]{12}$"
    },
    "schema_version": {
      "description": "Legacy manifest version. A manifest that carries it, and neither contract_version nor id, is a pre-1.0.0 folder: it still parses, and a tool should re-stamp it rather than reject it. It is no longer the compatibility gate and nothing should branch on its value.",
      "type": "integer",
      "deprecated": true
    },
    "kit_version": {
      "description": "Version of the kit that scaffolded this agent. Informational only - never a gate.",
      "type": [
        "string",
        "null"
      ]
    },
    "created_at": {
      "description": "ISO 8601 timestamp written by the scaffolder. Informational.",
      "type": [
        "string",
        "null"
      ]
    },
    "name": {
      "description": "Display name shown to humans.",
      "type": "string",
      "minLength": 1,
      "maxLength": 255
    },
    "slug": {
      "description": "Folder name and cloud reference. Must equal the agent folder's name.",
      "type": "string",
      "pattern": "^[a-z0-9][a-z0-9-]{1,62}$"
    },
    "description": {
      "description": "One sentence describing what the agent does. Feeds agent cards, the A2A card and router-trigger generation.",
      "type": "string",
      "minLength": 1,
      "maxLength": 2000
    },
    "example_prompts": {
      "description": "Ready-to-send task suggestions AND a first-class routing input. At least one is required for a cloud-ready agent.",
      "type": "array",
      "items": {
        "type": "string",
        "minLength": 1,
        "maxLength": 500
      },
      "maxItems": 20
    },
    "router_trigger_prompt": {
      "description": "One capability-verb sentence used only by the routing classifier. Describes when to route here, never how to behave.",
      "type": [
        "string",
        "null"
      ],
      "maxLength": 2000
    },
    "prompts": {
      "description": "Paths, relative to the agent root, of the three document-backed prompts.",
      "type": "object",
      "additionalProperties": false,
      "properties": {
        "workflow": {
          "type": "string"
        },
        "entrypoint": {
          "type": "string"
        },
        "refiner": {
          "type": "string"
        }
      }
    },
    "runtime": {
      "description": "How this agent should be run by a host that offers a choice. Absent means the host's default runtime. Never contains a secret: credential is a reference, not a key.",
      "type": [
        "object",
        "null"
      ],
      "additionalProperties": true,
      "properties": {
        "engine": {
          "description": "Which engine runs the agent. Known values: `opencode` (a host-managed OpenCode server) `claude` and `codex` (ACP adapters driving a CLI already installed on the machine under its own login). Added in contract 1.2.0; a host that does not recognise the value runs the agent on its own default engine rather than refusing the folder. Deliberately not an enum: a newer minor may name an engine this schema predates, and the contract's additive promise says such a folder must still validate. `claude`/`codex` and `credential` are not meaningful together \u2014 that engine uses no host credential.",
          "type": [
            "string",
            "null"
          ]
        },
        "model": {
          "description": "Model identifier as the host names it. Seeds the cloud's per-mode model override at import.",
          "type": [
            "string",
            "null"
          ]
        },
        "complexity": {
          "description": "How hard this agent's work is, as a portable alternative to a concrete model id: the host resolves it against the models the chosen credential actually offers. Mutually exclusive with `model`. Added in contract 1.1.0; a host that does not understand it falls back to `model`.",
          "type": [
            "string",
            "null"
          ],
          "enum": [
            "simple",
            "medium",
            "complex",
            null
          ]
        },
        "credential": {
          "description": "Reference to the AI credential to run on: a credential type, or the name of a credential configured in the host. NEVER a key, token or secret value.",
          "type": [
            "string",
            "null"
          ]
        },
        "permissions": {
          "description": "Host-specific permission profile for the agent's own tools. Interpreted by the host that wrote it; unknown keys are preserved.",
          "type": "object",
          "additionalProperties": true
        }
      }
    },
    "status_refresh_command": {
      "description": "Shell command, or a /run:<name> reference into docs/CLI_COMMANDS.yaml, executed before the platform reads STATUS.md.",
      "type": [
        "string",
        "null"
      ],
      "maxLength": 1024
    },
    "credentials": {
      "description": "Credential slots the agent needs. Never contains secret values.",
      "type": "array",
      "items": {
        "type": "object",
        "required": [
          "name",
          "type"
        ],
        "additionalProperties": true,
        "properties": {
          "name": {
            "type": "string",
            "minLength": 1,
            "maxLength": 255
          },
          "type": {
            "description": "A platform credential type. The values below are the types known at contract 1.0.0; they are advisory, not a closed set. The platform's list grows independently of any bundled contract, so a contract pinned in a shipped desktop build cannot track it - an unrecognised value is therefore tolerated here and reported as a warning, and is resolved against the authoritative list at import.",
            "type": "string",
            "examples": [
              "email_imap",
              "email_smtp",
              "odoo",
              "gmail_oauth",
              "gmail_oauth_readonly",
              "gdrive_oauth",
              "gdrive_oauth_readonly",
              "gcalendar_oauth",
              "gcalendar_oauth_readonly",
              "google_service_account",
              "api_token",
              "ssh_key"
            ]
          },
          "description": {
            "type": "string",
            "maxLength": 2000
          },
          "service_uri": {
            "description": "Explicit service slot for matching attached credentials of this type. Without it, match the declared name to the credential name or service_uri.",
            "type": "string",
            "minLength": 1
          },
          "env_prefix": {
            "description": "Prefix of the local .env variable names for this slot. Variable name is <env_prefix><FIELD in upper case>.",
            "type": "string",
            "pattern": "^[A-Z][A-Z0-9_]*_$"
          },
          "fields": {
            "description": "Field names of the credential payload, as the platform names them.",
            "type": "array",
            "items": {
              "type": "string",
              "minLength": 1
            }
          },
          "optional": {
            "type": "boolean"
          }
        }
      }
    },
    "schedules": {
      "description": "Unattended run declarations. Platform import may create schedules; desktop static-prompt execution requires separate per-profile opt-in on each device and runs only while the app is open.",
      "type": "array",
      "items": {
        "type": "object",
        "required": [
          "name",
          "cron_string",
          "schedule_type"
        ],
        "additionalProperties": true,
        "properties": {
          "name": {
            "type": "string",
            "minLength": 1,
            "maxLength": 255
          },
          "cron_string": {
            "description": "Standard five-field cron expression.",
            "type": "string",
            "pattern": "^\\S+\\s+\\S+\\s+\\S+\\s+\\S+\\s+\\S+$"
          },
          "timezone": {
            "description": "IANA timezone name. Desktop opt-in freezes this zone, or the current system zone when absent, for matching local schedule occurrences.",
            "type": [
              "string",
              "null"
            ]
          },
          "schedule_type": {
            "type": "string",
            "enum": [
              "static_prompt",
              "script_trigger"
            ]
          },
          "prompt": {
            "description": "Required for static_prompt: the message sent to start the run.",
            "type": [
              "string",
              "null"
            ]
          },
          "command": {
            "description": "Required for script_trigger: the shell command whose non-OK output starts a session.",
            "type": [
              "string",
              "null"
            ]
          },
          "enabled": {
            "type": "boolean"
          }
        },
        "allOf": [
          {
            "if": {
              "properties": {
                "schedule_type": {
                  "const": "script_trigger"
                }
              },
              "required": [
                "schedule_type"
              ]
            },
            "then": {
              "required": [
                "command"
              ],
              "properties": {
                "command": {
                  "type": "string",
                  "minLength": 1
                }
              }
            }
          },
          {
            "if": {
              "properties": {
                "schedule_type": {
                  "const": "static_prompt"
                }
              },
              "required": [
                "schedule_type"
              ]
            },
            "then": {
              "required": [
                "prompt"
              ],
              "properties": {
                "prompt": {
                  "type": "string",
                  "minLength": 1
                }
              }
            }
          }
        ]
      }
    },
    "handovers": {
      "description": "Sibling agent hints, or an explicit desktop return to the current task coordinator.",
      "type": "array",
      "items": {
        "type": "object",
        "required": [
          "target_slug"
        ],
        "additionalProperties": true,
        "properties": {
          "target_slug": {
            "type": "string",
            "pattern": "^[a-z0-9][a-z0-9-]{1,62}$"
          },
          "description": {
            "type": "string",
            "maxLength": 2000
          },
          "target_kind": {
            "type": "string",
            "description": "Optional host role. The exact pair target_kind=coordinator and target_slug=coordinator enables desktop coordinator handback. Unknown roles do not grant desktop execution authority."
          }
        }
      }
    },
    "features": {
      "description": "Cloud-only capabilities the agent expects once imported. Ignored locally.",
      "type": "object",
      "additionalProperties": true,
      "properties": {
        "webapp": {
          "type": "boolean"
        },
        "agent_api": {
          "type": "boolean"
        }
      }
    },
    "cloud": {
      "description": "DEPRECATED, replaced by the publications[] ledger, which lives in the sibling file publications.json and not in this one. Still accepted so a folder written before contract 1.0.0 parses; a tool that writes this manifest for any other reason migrates it into publications.json and drops the key. Never migrated at export time - an export must not mutate the manifest.",
      "type": "object",
      "deprecated": true,
      "additionalProperties": true,
      "properties": {
        "platform_url": {
          "type": [
            "string",
            "null"
          ]
        },
        "agent_id": {
          "type": [
            "string",
            "null"
          ]
        },
        "imported_at": {
          "type": [
            "string",
            "null"
          ]
        }
      }
    }
  }
}
